{
  "schemaVersion": "1.0.0",
  "id": "fixture.generation_job.expired",
  "providerKey": "fixture.provider.local",
  "modelSnapshot": "fixture-model-snapshot",
  "promptVersion": "fixture.prompt.v1",
  "seed": 107,
  "inputHash": "sha256:7777777777777777777777777777777777777777777777777777777777777777",
  "jobStatus": "expired",
  "requestedAtUtc": "2026-07-15T00:00:00Z",
  "cost": { "amount": 0, "currency": "CNY" },
  "auditStatus": "needs_review"
}
