{
  "schemaVersion": "1.0.0",
  "id": "fixture.generation_job.generating",
  "providerKey": "fixture.provider.local",
  "modelSnapshot": "fixture-model-snapshot",
  "promptVersion": "fixture.prompt.v1",
  "seed": 102,
  "inputHash": "sha256:2222222222222222222222222222222222222222222222222222222222222222",
  "jobStatus": "generating",
  "requestedAtUtc": "2026-07-15T00:00:00Z",
  "cost": { "amount": 0, "currency": "CNY" },
  "auditStatus": "needs_review"
}
